949682990333,DVH-2487654415,,Cancelled,,Moving location,Follow-up Visit,,,2022-01-03 14:28:51,Ballytroddan,,Northumberland,HL5H 9UN,Let them eat cake.,,,Ask not what your country can do for you; ask what you can do for your country.,,"Get your stinking paws off me, you damned dirty ape.",,Yes,0,2,1,1,0,7,5,4,No,86,72,38,34,43,27,74,51,51.0,Let them eat cake.,22.0,Ask not what your country can do for you; ask what you can do for your country.,59.0,Those who refuse to learn from history are condemned to repeat it.,77.0,Let them eat cake.,,You're gonna need a bigger boat.,17.0,The only thing we have to fear is fear itself.,61.0,Let them eat cake.,80.0,"Houston, we have a problem.",70.0,Mama always said life was like a box of chocolates. You never know what you're gonna get.,DHR-460216608327,X,Brittny Donovan,,,,,2019-09-03 16:41:00,bagpipes2048@gsnail.ac.uk,,,,,,1,1,,,,ONS34980659,1,ONS95980765,2022-01-01 03:18:43,,Prefer not to say,,Any other white background,,1,1,,0,1,,,0,,0,,,,,,,,Where are my pants?,Atoms are used within a program to denote distinguished values.,,,,,,,,,,,,,,,,,"She spent her earliest years reading classic literature, and writing poetry.",,,"In 1989 the building was heavily damaged by fire, but it has since been restored.",2,,,,,,,,,,,,,,,,,,No,,Yes,Yes,,Ask not what your country can do for you; ask what you can do for your country.,Yes,,The only thing we have to fear is fear itself.,Yes,,,,,,,,,,,,,,,,,,,,,,,,Where are my pants?,No,,Yes,,No,,,Yes,No,,,No,,No,No,Yes,,hdfs://dnt01/ons/covserolink/landing_zone/responses_v0/ONS_Datafile_20211108.csv,,,,,,,,,,,,,,,,,,,,,,,,,,,,,,,,,,,,,,,,,,,,,,,,,,,,,,,,,,,,,,,No,,,Yes,,,Yes,,,Yes,Yes,,,,,,3
280397771865,DVH-9537500738,,Scheduled,,Too many visits,First Visit,,,2022-01-07 12:47:14,Jaffa,Louth,,NE2K 5GM,,Swab Only,,Those who refuse to learn from history are condemned to repeat it.,,"Here's looking at you, kid.",,No,6,2,4,6,5,8,2,7,No,,63,50,85,3,12,53,74,,The only thing we have to fear is fear itself.,84.0,Let them eat cake.,66.0,I'm gonna make him an offer he can't refuse.,15.0,I'm gonna make him an offer he can't refuse.,63.0,"Get your stinking paws off me, you damned dirty ape.",83.0,They call me *Mister* Tibbs!,27.0,I'm gonna make him an offer he can't refuse.,53.0,They call me *Mister* Tibbs!,,"Houston, we have a problem.",DHR-051520734552,,,Mr.,Leif,,Freeman,,,,,,,,1,1,,,,ONS34980659,1,ONS29485098,2022-01-08 19:52:25,,Female,,Asian or Asian British-Indian,Do you come here often?,1,0,,0,0,,,0,,0,,,,,,,,Where are my pants?,Do you have any idea why this is not working?,"""Messages can be sent to and received from ports, but these messages must obey the so-called """"port protocol.""""""",He looked inquisitively at his keyboard and wrote another sentence.,Yes,No,,No,No,No,Atoms can contain any character if they are enclosed within single quotes and an escape convention exists which allows any character to be used within an atom.,,,No,,,Yes,Yes,"Mr. Gorbachev, open this gate! Mr. Gorbachev, tear down this wall!",,,Ask not what your country can do for you; ask what you can do for your country.,"One morning I shot an elephant in my pajamas. How he got in my pajamas, I don't know.",Let them eat cake.,No,Yes,Ports are created with the built-in function open_port.,,No,,No,,No,Yes,,Yes,Yes,No,,,Do you come here often?,,No,Yes,,Those who refuse to learn from history are condemned to repeat it.,,,"Here's looking at you, kid.",,,,,Yes,,8,Yes,Yes,Yes,Yes,Yes,Yes,No,Yes,1,,,,No,,,,Yes,No,No,No,,No,,Yes,,Yes,Yes,No,No,,,No,,,Yes,,No,,,,No,Negative,"Here's looking at you, kid.",,,,,,,,,,,,,,,,,,,,,,,,,,,,,,,,,hdfs://dnt01/ons/covserolink/landing_zone/responses_v1/ONSECRF4_Datafile_20211108.csv,Yes,No,,,,,,,,,,,,,,,,,,,,,,,,,,,,,,,,,,,,,3
310465055277,DVH-1464500971,Dispatched,Completed,Withdrawn,No longer convenient,Follow-up Visit,Month 5,Swab Only,2022-01-07 23:29:09,,,,EE6Q 9SB,,Swab Only,,,,,Declined,,1,8,5,0,1,,8,6,,74,21,16,69,5,10,6,61,94.0,Ask not what your country can do for you; ask what you can do for your country.,71.0,Ask not what your country can do for you; ask what you can do for your country.,100.0,Mama always said life was like a box of chocolates. You never know what you're gonna get.,20.0,Let them eat cake.,,"Elementary, my dear Watson.",,"Mr. Gorbachev, open this gate! Mr. Gorbachev, tear down this wall!",,Let them eat cake.,,Ask not what your country can do for you; ask what you can do for your country.,,They call me *Mister* Tibbs!,DHR-179815158112,,,Mr.,Andreas,Ivory,Alexander,2020-03-24 12:20:00,,No,Yes,,Paper(Post),true,1,,No,No stock,Two attempts made,ONS34980659,,ONS17139656,2022-01-02 17:32:09,,Prefer not to say,Black or African or Caribbean or Black British,"Black,Caribbean,Afro-Caribbean",Tuples are containers for a fixed number of Erlang data types.,No,No,Yes,Yes,Yes,,Yes,Yes,Yes,Yes,No,,True,No,False,,False,"HASKELL IS A STANDARDIZED, GENERAL-PURPOSE PURELY FUNCTIONAL PROGRAMMING LANGUAGE, WITH NON-STRICT SEMANTICS AND STRONG STATIC TYPING",PORTS ARE USED TO COMMUNICATE WITH THE EXTERNAL WORLD,Arts or entertainment or recreation,Its main implementation is the Glasgow Haskell Compiler.,Yes,Other healthcare (e.g. mental health),No,Yes,,,"Yes, cigar",,Yes,,Yes,No,,No,,Yes,No,,6,On foot,Difficult to maintain 2 meters - but I can usually be at least 1m from other people,,Sore  Throat,,,Yes,Yes,No,No,No,,No,Yes,Yes,,Yes,Yes because you have/have had symptoms of COVID-19,,Participant Would Not/Could Not Answer,Yes,2022-01-06 00:00:00,,Yes,2022-01-07 00:00:00,,,,,Yes,Participant Would Not/Could Not Answer,Yes,"[3, 13, 20, 0, 23, 12, 8, 13]",0,11-20,Participant Would Not/Could Not Answer,11-20,21 or more,21 or more,1,5,1,Participant Would Not/Could Not Answer,Participant Would Not/Could Not Answer,,Yes usually both at work/school and in other situations,My face is already covered for other reasons (e.g. religious or cultural reasons),Yes sometimes,Yes,,No,,No,No,,,Yes,Yes,No,No,,No,Yes,,,,,Yes,,Yes,Waiting for all results,,,No,All tests failed,Home Test,,2022-01-04 00:00:00,No,Yes a little,Headache,,,No,Yes,Yes,No,No,No,,No,Yes,Yes,No,Yes,,,Yes,,,,No,No,,Don't know type,OtherVaxx,,2022-01-05 00:00:00,,No,Venezuela,,Yes,hdfs://dnt01/ons/covserolink/landing_zone/responses_v2/ONSECRF5_Datafile_20211108.csv,DHR-1798151581122022-01-07 23:29:09,1.0,,2022-01-07,2022-01-02,2020-03-24,yes,yes,EE6Q,,1.0,,,,,,<=15y,No,,,,,,,,,,,,,,,No,3
411985200014,DHVF-1308254662,Withdrawn,Scheduled,Withdrawn,Too many visits,Follow-up Visit,Month 6,Blood and Swab,2022-01-07 07:50:26,,Blackpool,Cumbria,TN7M 7NC,,Swab Only,,,,,Invited,,2,1,6,7,6,8,7,6,Yes,64,,16,36,60,91,31,101,39.0,Those who refuse to learn from history are condemned to repeat it.,28.0,"""You've got to ask yourself one question: """"Do I feel lucky?"""" Well, do ya? Punk!""",19.0,Mama always said life was like a box of chocolates. You never know what you're gonna get.,40.0,A census taker once tried to test me. I ate his liver with some fava beans and a nice Chianti.,,I'm gonna make him an offer he can't refuse.,59.0,"Here's looking at you, kid.",86.0,"Frankly, my dear, I don't give a damn.",46.0,Let them eat cake.,,"Frankly, my dear, I don't give a damn.",DHR-981176815011,,,,Johnette,Zachary,Nunez,1981-05-15 21:46:00,,No,Yes,Yes,Email,false,1,,No,Participant refused to give blood on this visit,Two attempts made,ONS49710563,,,2022-01-03 14:52:25,Female,Prefer not to say,Other Ethnic Group,Any other ethnic group,Erlang is known for its designs that are well suited for systems.,No,No,No,No,No,Yes,,Yes,Yes,Yes,,No,False,,False,No,False,MAKE ME A SANDWICH,HASKELL FEATURES A TYPE SYSTEM WITH TYPE INFERENCE AND LAZY EVALUATION,Hospitality (e.g. hotel or restaurant or cafe),"The syntax {D1,D2,...,Dn} denotes a tuple whose arguments are D1, D2, ... Dn.",Yes,,,No,,No,"Yes, pipe",Vape/e-cigarettes,,No,No,Yes,,,Attending university (including if temporarily absent)Self-employed and currently working (include if on leave or sick leave for less than 4 weeks),,Yes,From home (in the same grounds or building as your home)Somewhere else (not at your home),5,Bicycle,Very difficult to be more than 1 meter away as my work means I am in close contact with others on a regular basis,No,Sore  Throat,,Yes,No,Yes,,,Yes,No,No,,,No,Yes,,,No,No,,Outside your home,Yes,2022-01-07 00:00:00,Outside your home,,,,Yes,Participant Would Not/Could Not Answer,No,"[11, 16, 20, 23, 14, 11, 14, 23]",0,11-20,21 or more,11-20,Participant Would Not/Could Not Answer,0,Participant Would Not/Could Not Answer,1,None,0,None,No,Yes at work/school only,,Participant Would Not/Could Not Answer,,No,No,Yes,No,Yes,,No,,No,No,,,No,Yes,2022-01-07 00:00:00,No,,,No,,No,Waiting for all results,2022-01-01 00:00:00,2022-01-07 00:00:00,,One or more positive test(s),,,2022-01-07 00:00:00,Yes,Not at all,Difficulty concentrating,,,Yes,,No,Yes,,,No,No,,,,No,,,,Yes,,Yes,No,No,Yes,Moderna,OtherVaxx,3 or more,2022-01-09 00:00:00,,No,Oman,,No,hdfs://dnt01/ons/covserolink/landing_zone/responses_v2/ONSECRF5_Datafile_20211108.csv,DHR-9811768150112022-01-07 07:50:26,1.0,,2022-01-07,2022-01-03,1981-05-15,no,yes,TN7M,,40.0,20-49,16-49,35-49,40-44,,,No,,,,,,,,,,,,,,,No,1
977173686582,DVH-2587127390,Dispatched,Re-scheduled,Active,No longer wants to take part,First Visit,Month 7,Blood and Swab,2022-01-07 08:33:56,,Worcester,,,,Swab Only,,,,,Accepted,No,3,2,8,1,0,6,4,5,Yes,71,28,39,73,77,80,,0,38.0,A census taker once tried to test me. I ate his liver with some fava beans and a nice Chianti.,68.0,"Mr. Gorbachev, open this gate! Mr. Gorbachev, tear down this wall!",,Ask not what your country can do for you; ask what you can do for your country.,,The only thing we have to fear is fear itself.,74.0,Those who refuse to learn from history are condemned to repeat it.,,The only thing we have to fear is fear itself.,,Those who refuse to learn from history are condemned to repeat it.,96.0,Let them eat cake.,76.0,The only thing we have to fear is fear itself.,DHR-360029915786,,,Mrs.,Shela,Minh,Burks,2015-01-31 23:29:00,interscene1819@gsnail.ac.uk,No,Yes,,Email,false,0,,Yes,Participant felt unwell/fainted,Participant dehydrated,ONS87319198,,ONS87203229,,Female,Male,Black or African or Caribbean or Black British,Asian or Asian British-Chinese,It is also a garbage-collected runtime system.,No,Yes,Yes,Yes,No,Yes,No,Yes,No,Yes,No,,True,,False,No,True,TYPE CLASSES FIRST APPEARED IN THE HASKELL PROGRAMMING LANGUAGE,DO YOU HAVE ANY IDEA WHY THIS IS NOT WORKING?,Other occupation sector,"Haskell is a standardized, general-purpose purely functional programming language, with non-strict semantics and strong static typing.",,"Primary care (e.g. GP, dentist)",Yes,No,Not at all,No,"Yes,  cigarettes",Pipe,No,No,,,,No,Attending university (including if temporarily absent)Self-employed and currently working (include if on leave or sick leave for less than 4 weeks),,Yes,From home (in the same grounds or building as your home)Somewhere else (not at your home),6,Other method,,Yes,Sore  Throat,,Yes,Yes,No,No,No,,Yes,,,No,Yes,,Yes for other reasons related to reducing your risk of getting COVID-19 (e.g. going into hospital orshielding),,Participant Would Not/Could Not Answer,No,,Living in your own home,Yes,,Living in your own home,,,No,,Yes,No,"[9, 0, 19, 18, 15, 1, 5, 2]",Participant Would Not/Could Not Answer,1-5,11-20,0,1-5,1-5,6,7 times or more,,3,5,Yes,No,Not going to place of work or education,Yes always,,Yes,Yes,Yes,No,,,Yes,,No,Yes,Yes,No,Yes,,,,,,No,,,One or more positive test(s),2022-01-04 00:00:00,2022-01-06 00:00:00,Yes,One or more positive test(s),Private Lab,,,No,Not at all,Shortness of breath,No,No,,,Yes,,No,,No,No,,No,,No,Yes,Yes,No,,No,,Yes,Yes,Yes,Other / specify,,2,,,,Uganda,2021-05-27 00:00:00,,hdfs://dnt01/ons/covserolink/landing_zone/responses_v2/ONSECRF5_Datafile_20211108.csv,DHR-3600299157862022-01-07 08:33:56,1.0,False,2022-01-07,,2015-01-31,yes,yes,,,6.0,2-11,,2-11,5-9,2.0,<=15y,No,,,,,,,,,,,,,,,No,1
708187875277,DHVF-6788976756,,Scheduled,,No longer convenient,First Visit,,,2022-01-02 05:38:34,Glenmont,,Shropshire,IS5E 6JT,A census taker once tried to test me. I ate his liver with some fava beans and a nice Chianti.,,,"One morning I shot an elephant in my pajamas. How he got in my pajamas, I don't know.",,Mama always said life was like a box of chocolates. You never know what you're gonna get.,,No,0,7,7,4,8,3,2,8,No,5,48,91,9,24,84,,20,73.0,"Elementary, my dear Watson.",77.0,You're gonna need a bigger boat.,16.0,"One morning I shot an elephant in my pajamas. How he got in my pajamas, I don't know.",74.0,"""You've got to ask yourself one question: """"Do I feel lucky?"""" Well, do ya? Punk!""",84.0,They call me *Mister* Tibbs!,,"Houston, we have a problem.",87.0,"Frankly, my dear, I don't give a damn.",51.0,"Frankly, my dear, I don't give a damn.",90.0,"One morning I shot an elephant in my pajamas. How he got in my pajamas, I don't know.",DHR-792161153451,P,Hanh Conner,,,,,1998-07-28 19:26:00,,,,,,,0,0,,,,ONS76983513,0,ONS39274499,2022-01-02 23:15:45,Male,Prefer not to say,,Mixed-White & Asian,,0,0,,1,0,,,1,,1,,,,,,,,"Erlang is a general-purpose, concurrent, functional programming language.",Where are my pants?,,,,,,,,,,,,,,,,,He looked inquisitively at his keyboard and wrote another sentence.,,,"The Galactic Empire is nearing completion of the Death Star, a space station with the power to destroy entire planets.",6,,,,,,,,,,,,,,,,,,Yes,No,,,,The only thing we have to fear is fear itself.,,,"Here's looking at you, kid.",,No,,,,,,,,,,,,,,,,,,,,,No,,"The Galactic Empire is nearing completion of the Death Star, a space station with the power to destroy entire planets.",Yes,Yes,No,Yes,No,,Yes,No,,,,No,,No,,,,hdfs://dnt01/ons/covserolink/landing_zone/responses_v0/ONS_Datafile_20211108.csv,,,,,,,,,,,,,,,,,,,,,,,,,,,,,,,,,,,,,,,,,,,,,,,,,,,,,,,,,,,,,,,No,No,Yes,,No,No,Yes,No,No,No,Yes,,Yes,,Yes,,2
154902533133,DVH-6295868880,,Patient did not attend,,No longer wants to take part,First Visit,,,2022-01-05 06:56:45,,,,YR1T 2PT,,Blood and Swab,,"""You've got to ask yourself one question: """"Do I feel lucky?"""" Well, do ya? Punk!""",,"Houston, we have a problem.",,Yes,3,4,1,,0,3,8,0,,90,45,42,37,,34,56,54,80.0,"""You've got to ask yourself one question: """"Do I feel lucky?"""" Well, do ya? Punk!""",47.0,You're gonna need a bigger boat.,76.0,"Houston, we have a problem.",,"One morning I shot an elephant in my pajamas. How he got in my pajamas, I don't know.",47.0,"Get your stinking paws off me, you damned dirty ape.",67.0,"Elementary, my dear Watson.",47.0,"""You've got to ask yourself one question: """"Do I feel lucky?"""" Well, do ya? Punk!""",4.0,You're gonna need a bigger boat.,36.0,They call me *Mister* Tibbs!,DHR-221993521588,,,LL.D,Seth,,Burke,1983-12-05 16:13:00,,,,,,,1,0,,,,ONS76983513,0,ONS52583295,2022-01-05 15:39:55,,,,Mixed-White & Black African,Do you have any idea why this is not working?,1,1,,1,1,,,0,,0,,,,,,,,I don't even care.,"The syntax {D1,D2,...,Dn} denotes a tuple whose arguments are D1, D2, ... Dn.",Type classes first appeared in the Haskell programming language.,"Erlang is a general-purpose, concurrent, functional programming language.",No,No,No,Yes,Yes,,Make me a sandwich.,,Yes,,No,Yes,No,,"""You've got to ask yourself one question: """"Do I feel lucky?"""" Well, do ya? Punk!""",,,I'm gonna make him an offer he can't refuse.,Ask not what your country can do for you; ask what you can do for your country.,A census taker once tried to test me. I ate his liver with some fava beans and a nice Chianti.,Yes,Yes,"The syntax {D1,D2,...,Dn} denotes a tuple whose arguments are D1, D2, ... Dn.",,,Yes,,,Yes,Yes,,No,No,Yes,Yes,No,The arguments can be primitive data types or compound data types.,,,,,Let them eat cake.,No,,"Get your stinking paws off me, you damned dirty ape.",,,,Yes,Yes,,3,Yes,No,No,No,,,,,7,,,,No,,,No,,Yes,No,No,No,Yes,Yes,No,Yes,Yes,Yes,,Yes,Yes,,,,,Yes,,,,,,Yes,Negative,You're gonna need a bigger boat.,,,,,,,,,,,,,,,,,,,,,,,,,,,,No,,,,,hdfs://dnt01/ons/covserolink/landing_zone/responses_v1/ONSECRF4_Datafile_20211108.csv,,,,,,,,,,,,,,,,,,,,,,,,,,,,,,,,,,,,,,,2
375199199359,DHVF-8927117625,,Re-scheduled,,,First Visit,,,2022-01-04 06:23:44,,,,,,Swab Only,,"Elementary, my dear Watson.",,"One morning I shot an elephant in my pajamas. How he got in my pajamas, I don't know.",,No,4,3,6,5,1,1,3,6,No,57,12,57,42,50,,21,43,7.0,"Get your stinking paws off me, you damned dirty ape.",22.0,I'm gonna make him an offer he can't refuse.,57.0,"Frankly, my dear, I don't give a damn.",75.0,They call me *Mister* Tibbs!,,You're gonna need a bigger boat.,60.0,"Frankly, my dear, I don't give a damn.",,I'm gonna make him an offer he can't refuse.,61.0,"Houston, we have a problem.",27.0,Let them eat cake.,DHR-226364567384,,,Master,Abraham,,Levine,2010-09-13 10:11:00,flounder2020@gsnail.ac.uk,,,,,,0,0,,,,ONS78549044,1,ONS51982661,2022-01-07 05:22:00,,Prefer not to say,,White-British,I don't even care.,1,0,,1,0,,,0,,0,,,,,,,,The arguments can be primitive data types or compound data types.,Ports are used to communicate with the external world.,Do you come here often?,Any element of a tuple can be accessed in constant time.,,Yes,Yes,,,,The arguments can be primitive data types or compound data types.,,Yes,No,No,,Yes,,"Houston, we have a problem.",,,A census taker once tried to test me. I ate his liver with some fava beans and a nice Chianti.,Ask not what your country can do for you; ask what you can do for your country.,"Here's looking at you, kid.",,No,Tuples are containers for a fixed number of Erlang data types.,,,,,Yes,No,Yes,,,,Yes,No,Yes,The arguments can be primitive data types or compound data types.,,Yes,No,,"Here's looking at you, kid.",Yes,,"One morning I shot an elephant in my pajamas. How he got in my pajamas, I don't know.",,,,,Yes,,4,No,,Yes,No,,No,No,Yes,4,,,,Yes,,,,No,Yes,,No,No,Yes,Yes,Yes,,Yes,Yes,,,No,,Yes,,,Yes,,,Yes,,,,Positive,The only thing we have to fear is fear itself.,,,,,,,,,,,,,,,,,,,,,,,,,,,,No,,,,,hdfs://dnt01/ons/covserolink/landing_zone/responses_v1/ONSECRF4_Datafile_20211108.csv,No,,,,,,,,,,,,,,,,,,,,,,,,,,,,,,,,,,,,,,3
594679153484,DVH-0065292054,,Cancelled,,Moving location,Follow-up Visit,,,2022-01-07 06:39:13,Grainon,,,,,Swab Only,,"Here's looking at you, kid.",,Those who refuse to learn from history are condemned to repeat it.,,Yes,1,0,6,1,2,,4,1,,,54,71,90,5,57,4,11,67.0,They call me *Mister* Tibbs!,90.0,"Houston, we have a problem.",90.0,"Elementary, my dear Watson.",82.0,"Mr. Gorbachev, open this gate! Mr. Gorbachev, tear down this wall!",49.0,"Elementary, my dear Watson.",32.0,"Frankly, my dear, I don't give a damn.",72.0,"Mr. Gorbachev, open this gate! Mr. Gorbachev, tear down this wall!",61.0,"Frankly, my dear, I don't give a damn.",47.0,A census taker once tried to test me. I ate his liver with some fava beans and a nice Chianti.,DHR-833239807498,,,MMath,Irvin,,Garza,2007-09-11 02:25:00,tarsier1942@gsnail.ac.uk,,,,,,0,1,,,,ONS78549044,0,,2022-01-07 09:42:51,Male,,,Mixed-White & Black Caribbean,Tuples are containers for a fixed number of Erlang data types.,0,1,,0,1,,,1,,0,,,,,,,,"""Messages can be sent to and received from ports, but these messages must obey the so-called """"port protocol.""""""","They are written as strings of consecutive alphanumeric characters, the first character being lowercase.",Type classes first appeared in the Haskell programming language.,"The syntax {D1,D2,...,Dn} denotes a tuple whose arguments are D1, D2, ... Dn.",No,No,,,,No,Ports are created with the built-in function open_port.,,Yes,Yes,Yes,Yes,Yes,Yes,Let them eat cake.,,,"Houston, we have a problem.","Here's looking at you, kid.",They call me *Mister* Tibbs!,,,Its main implementation is the Glasgow Haskell Compiler.,,No,,,,Yes,,Yes,Yes,,Yes,No,Yes,"The syntax {D1,D2,...,Dn} denotes a tuple whose arguments are D1, D2, ... Dn.",,,No,,"Elementary, my dear Watson.",Yes,,"Get your stinking paws off me, you damned dirty ape.",,,,,,,7,No,,,No,Yes,No,No,No,6,,,,Yes,,,Yes,Yes,Yes,Yes,No,Yes,No,No,Yes,,,Yes,Yes,Yes,Yes,,No,,,,,No,,,,No,Positive,"Elementary, my dear Watson.",,,,,,,,,,,,,,,,,,,,,,,,,,,,,,,,,hdfs://dnt01/ons/covserolink/landing_zone/responses_v1/ONSECRF4_Datafile_20211108.csv,No,No,,,,,,,,,,,,,,,,,,,,,,,,,,,,,,,,,,,,,3
408894487888,DVH-6536874006,Household did not attend,Re-scheduled,Completed,Swab / blood process to distressing,First Visit,Follow-up 4,,2022-01-08 00:45:30,,Cheltenham,,QY2R 2LG,,Swab Only,,,,,Declined,Yes,,3,3,6,7,0,7,8,No,14,23,41,55,,43,17,,73.0,The only thing we have to fear is fear itself.,94.0,I'm gonna make him an offer he can't refuse.,98.0,Ask not what your country can do for you; ask what you can do for your country.,,Let them eat cake.,,"Frankly, my dear, I don't give a damn.",60.0,Let them eat cake.,,They call me *Mister* Tibbs!,,Ask not what your country can do for you; ask what you can do for your country.,39.0,Those who refuse to learn from history are condemned to repeat it.,DHR-878673472687,,,Miss.,Cedric,Dell,Matthews,,unsobering1915@gsnail.ac.uk,Yes,,Yes,Paper(Post),false,0,,No,Other,Participant dehydrated,ONS78549044,,ONS05581901,2022-01-04 22:14:25,Female,Male,Asian or Asian British,Any other white background,Any element of a tuple can be accessed in constant time.,No,No,Yes,Yes,Yes,Yes,,No,No,Yes,No,No,True,,True,Yes,False,DO YOU HAVE ANY IDEA WHY THIS IS NOT WORKING?,HASKELL FEATURES A TYPE SYSTEM WITH TYPE INFERENCE AND LAZY EVALUATION,Transport (incl. storage and logistics),"""Messages can be sent to and received from ports, but these messages must obey the so-called """"port protocol.""""""",Yes,"Primary care (e.g. GP, dentist)",Yes,Yes,"Yes, a lot",,,,Yes,,No,,,,Employed and currently working (including if on leave or sick leave for less than 4 weeks),No,Yes,From home (in the same grounds or building as your home)Somewhere else (not at your home),2,,Easy to maintain 2m - it is not a problem to stay this far away from other people,Yes,,2022-01-03 00:00:00,Yes,,No,Yes,No,Yes,Yes,No,,No,Yes,No,Yes because you live with someone who has/has had symptoms or a positive test but you haven't hadsymptoms yourself,,Participant Would Not/Could Not Answer,,2022-01-09 00:00:00,Outside your home,Yes,,Outside your home,,,No,Participant Would Not/Could Not Answer,,Participant Would Not/Could Not Answer,"[4, 9, 4, 21, 22, 21, 5, 22]",11-20,1-5,1-5,0,,6-10,Participant Would Not/Could Not Answer,,3,1,0,No,Yes usually both at work/school and in other situations,Not going to place of work or education,My face is already covered for other reasons (e.g. religious or cultural reasons),No,Yes,No,,Yes,,,Yes,,,Yes,Yes,No,,No,,Yes,,,,,No,One or more positive test(s),2022-01-05 00:00:00,,No,All tests failed,Private Lab,,2022-01-06 00:00:00,,Yes a little,Sore  Throat,No,No,,Yes,,Yes,,Yes,No,Yes,Yes,No,,,Yes,No,,No,No,,Yes,No,No,Moderna,OtherVaxx,1,2022-01-09 00:00:00,,,Oman,,Yes,hdfs://dnt01/ons/covserolink/landing_zone/responses_v2/ONSECRF5_Datafile_20211108.csv,DHR-8786734726872022-01-08 00:45:30,1.0,False,2022-01-08,2022-01-04,,yes,yes,QY2R,,,,,,,,,No,,,,,,,,,,,,,,,No,3
297184780210,DVH-5707422805,,Cancelled,,Swab / blood process to distressing,First Visit,,,2022-01-04 19:23:52,Invergourie,,Avon,TE4H 2TC,"Houston, we have a problem.",,,"Frankly, my dear, I don't give a damn.",,Let them eat cake.,,No,0,8,3,1,3,2,0,2,Yes,79,,61,12,52,72,17,,38.0,"Here's looking at you, kid.",67.0,"Mr. Gorbachev, open this gate! Mr. Gorbachev, tear down this wall!",90.0,I'm gonna make him an offer he can't refuse.,,"One morning I shot an elephant in my pajamas. How he got in my pajamas, I don't know.",31.0,"Elementary, my dear Watson.",22.0,A census taker once tried to test me. I ate his liver with some fava beans and a nice Chianti.,41.0,I'm gonna make him an offer he can't refuse.,25.0,"Frankly, my dear, I don't give a damn.",84.0,Mama always said life was like a box of chocolates. You never know what you're gonna get.,DHR-230989644996,U,Argentina Brady,,,,,2008-01-24 11:39:00,fortes2058@gsnail.ac.uk,,,,,,1,0,,,,ONS65265604,1,,2022-01-09 17:18:11,Male,Male,,Mixed-White & Black African,,1,0,,0,0,,,0,,0,,,,,,,,"They are written as strings of consecutive alphanumeric characters, the first character being lowercase.",Type classes first appeared in the Haskell programming language.,,,,,,,,,,,,,,,,,"In 1989 the building was heavily damaged by fire, but it has since been restored.",,,"The Galactic Empire is nearing completion of the Death Star, a space station with the power to destroy entire planets.",7,,,,,,,,,,,,,,,,,,No,No,No,No,,Mama always said life was like a box of chocolates. You never know what you're gonna get.,Yes,,"Here's looking at you, kid.",Yes,,,,,,,,,,,,,,,,,,,,,,Yes,,"The syntax {D1,D2,...,Dn} denotes a tuple whose arguments are D1, D2, ... Dn.",No,Yes,,,,Yes,Yes,Yes,,No,No,,,,,No,Yes,hdfs://dnt01/ons/covserolink/landing_zone/responses_v0/ONS_Datafile_20211108.csv,,,,,,,,,,,,,,,,,,,,,,,,,,,,,,,,,,,,,,,,,,,,,,,,,,,,,,,,,,,,,,,Yes,No,,,No,No,,,No,No,,,No,No,,,3
