ons_household_id,visit_id,visit_status,participant_visit_status,participant_status,withdrawal_reason,type_of_visit,visit_order,participant_testing_group,visit_datetime,street,city,county,postcode,phase,study_cohort,no_paticicpants_not_consented,reason_participants_not_consented,no_participants_not_present,reason_participants_not_present,fingerprick_status_household,household_members_under_2_years,infant_1_age,infant_2_age,infant_3_age,infant_4_age,infant_5_age,infant_6_age,infant_7_age,infant_8_age,household_members_over_2_years_and_not_present,person_1_age,person_2_age,person_3_age,person_4_age,person_5_age,person_6_age,person_7_age,person_8_age,person_1_not_consenting_age,person_1_reason_for_not_consenting,person_2_not_consenting_age,person_2_reason_for_not_consenting,person_3_not_consenting_age,person_3_reason_for_not_consenting,person_4_not_consenting_age,person_4_reason_for_not_consenting,person_5_not_consenting_age,person_5_reason_for_not_consenting,person_6_not_consenting_age,person_6_reason_for_not_consenting,person_7_not_consenting_age,person_7_reason_for_not_consenting,person_8_not_consenting_age,person_8_reason_for_not_consenting,person_9_not_consenting_age,person_9_reason_for_not_consenting,participant_id,suffix,full_name,title,first_name,middle_name,last_name,date_of_birth,email,have_landline_number,have_mobile_number,have_email_address,prefer_receive_vouchers,confirm_receive_vouchers,no_email_address,bloods_taken,able_to_take_blood,no_blood_reason_fingerprick,no_blood_reason_venous,blood_sample_barcode,swabs_taken,swab_sample_barcode,samples_taken_datetime,sex,gender,ethnic_group,ethnicity,ethnicity_other,consent_1_visit,consent_5_visits,consent_april_22,consent_16_visits,consent_blood_test,consent_finger_prick_a1_a3,consent_extend_study_under_16_b1_b3,consent_contact_extra_research,consent_contact_extra_researchyn,consent_use_of_surplus_blood_samples,consent_use_of_surplus_blood_samplesyn,approached_for_blood_samples,consent_blood_samples_if_positive,consent_blood_samples_if_positiveyn,consent_fingerprick_blood_samples,accepted_invite_fingerprick,reconsented_blood,work_main_job_title,work_main_job_role,work_sectors,work_sectors_other,work_nursing_or_residential_care_home,work_health_care,work_direct_contact_persons,illness_lasting_over_12_months,illness_reduces_activity_or_ability,have_ever_smoked_regularly,smokes_or_vapes_description,smokes_or_vapes,smoke_cigarettes,smokes_cigar,smokes_pipe,smokes_vape_e_cigarettes,smoke_no,smokes_hookah_shisha_pipes,work_status,work_in_additional_paid_employment,work_main_job_changed,work_location,work_not_from_home_days_per_week,transport_to_work_or_school,ability_to_socially_distance_at_work_or_school,had_symptoms_last_7_days,which_symptoms_last_7_days,symptoms_last_7_days_onset_date,symptoms_last_7_days_fever,symptoms_last_7_days_muscle_ache_myalgia,symptoms_last_7_days_fatigue_weakness,symptoms_last_7_days_sore_throat,symptoms_last_7_days_cough,symptoms_last_7_days_shortness_of_breath,symptoms_last_7_days_headache,symptoms_last_7_days_nausea_vomiting,symptoms_last_7_days_abdominal_pain,symptoms_last_7_days_diarrhoea,symptoms_last_7_days_loss_of_taste,symptoms_last_7_days_loss_of_smell,is_self_isolating,received_shielding_letter,think_have_covid_symptoms,contact_known_positive_covid_last_28_days,last_covid_contact_date,last_covid_contact_location,contact_suspect_positive_covid_last_28_days,last_suspected_covid_contact_date,last_suspected_covid_contact_location,hospital_last_2wks_household,care_home_last_2wks_household,hospital_last_28_days,hospital_last_28_days_other_household_member,care_home_last_28_days,care_home_last_28_days_other_household_member,hours_a_day_with_someone_else_at_home,physical_contact_under_18_years,physical_contact_18_to_69_years,physical_contact_over_70_years,social_distance_contact_under_18_years,social_distance_contact_18_to_69_years,social_distance_contact_over_70_years,times_hour_or_longer_another_home_last_7_days,times_hour_or_longer_another_person_your_home_last_7_days,times_outside_shopping_or_socialising_last_7_days,times_shopping_last_7_days,times_socialise_last_7_days,is_regularly_lateral_flow_testing,face_covering_outside_of_home,face_covering_work,face_covering_other_enclosed_places,think_had_covid,think_had_covid_any_symptoms,think_had_covid_which_symptoms,symptoms_since_last_visit_fever,symptoms_since_last_visit_muscle_ache_myalgia,symptoms_since_last_visit_fatigue_weakness,symptoms_since_last_visit_sore_throat,symptoms_since_last_visit_cough,symptoms_since_last_visit_shortness_of_breath,symptoms_since_last_visit_headache,symptoms_since_last_visit_nausea_vomiting,symptoms_since_last_visit_abdominal_pain,symptoms_since_last_visit_diarrhoea,symptoms_since_last_visit_loss_of_taste,symptoms_since_last_visit_loss_of_smell,think_had_covid_date,think_had_covid_contacted_nhs,think_had_covid_tested,think_had_codiv_test_result,think_had_covid_admitted_to_hospital,survey_responses_v0_source_file,other_pcr_test_since_last_visit,other_pcr_test_results,other_pcr_test_first_positive_date,other_pcr_test_last_negative_date,other_antibody_test_since_last_visit,other_antibody_test_results,other_antibody_test_location,other_antibody_test_first_positive_date,other_antibody_test_last_negative_date,have_long_covid_symptoms,long_covid_reduce_activities,long_covid_symptoms,long_covid_fever,long_covid_weakness_tiredness,long_covid_diarrhoea,long_covid_loss_of_smell,long_covid_shortness_of_breath,long_covid_vertigo_dizziness,long_covid_trouble_sleeping,long_covid_headache,long_covid_nausea_vomiting,long_covid_loss_of_appetite,long_covid_sore_throat,long_covid_chest_pain,long_covid_worry_anxiety,long_covid_memory_loss_or_confusion,long_covid_muscle_ache,long_covid_abdominal_pain,long_covid_loss_of_taste,long_covid_cough,long_covid_palpitations,long_covid_low_mood,long_covid_difficulty_concentrating,cis_covid_vaccine_offered,cis_covid_vaccine_received,cis_covid_vaccine_type,cis_covid_vaccine_type_other,cis_covid_vaccine_number_of_doses,cis_covid_vaccine_date,survey_responses_v1_source_file,outside_uk_since_april_2020,outside_uk_last_country,outside_uk_last_date,outside_uk_since_last_visit,survey_responses_v2_source_file,unique_participant_response_id,survey_response_dataset_major_version,bad_email,visit_date_string,sample_taken_date_string,date_of_birth_string,swab_taken,blood_taken,outward_postcode,consent,age_at_visit,age_group_5_intervals,age_group_over_16,age_group_7_intervals,age_group_5_year_intervals,school_year_september,work_patient_facing_now,work_social_care,have_covid_symptoms,symptoms_today,symptoms_today_fever,symptoms_today_muscle_ache,symptoms_today_fatigue,symptoms_today_sore_throat,symtpoms_today_cough,symptoms_today_shortness_of_breath,symptoms_today_headache,symptoms_today_nausea,sympotms_today_abdominal_pain,symptoms_today_diarrhoea,symptoms_today_taste_loss,symptoms_today_smell_loss,work_person_facing_now,count_barcode_voyager
413403018954,DHVF-1477511783,,Completed,,Bad experience with tester / survey,First Visit,,,2022-01-02 10:07:21,Carnlelis,Salford,,WH6P 1TO,Mama always said life was like a box of chocolates. You never know what you're gonna get.,,,I'm gonna make him an offer he can't refuse.,,Let them eat cake.,,No,0,2,1,4,5,8,8,2,Yes,63,4,45,26,55,58,62,60,57.0,"Here's looking at you, kid.",59.0,"Frankly, my dear, I don't give a damn.",40.0,"""You've got to ask yourself one question: """"Do I feel lucky?"""" Well, do ya? Punk!""",67.0,I'm gonna make him an offer he can't refuse.,,Mama always said life was like a box of chocolates. You never know what you're gonna get.,68.0,You're gonna need a bigger boat.,12.0,Those who refuse to learn from history are condemned to repeat it.,89.0,The only thing we have to fear is fear itself.,84.0,The only thing we have to fear is fear itself.,DHR-807591872943,V,Buck Meyers,,,,,2011-04-04 04:54:00,balate1925@gsnail.ac.uk,,,,,,0,0,,,,ONS84060153,1,ONS95980765,2022-01-04 01:09:44,Male,Female,,Asian or Asian British-Chinese,,1,1,,1,0,,,1,,0,,,,,,,,"The Galactic Empire is nearing completion of the Death Star, a space station with the power to destroy entire planets.","The syntax {D1,D2,...,Dn} denotes a tuple whose arguments are D1, D2, ... Dn.",,,,,,,,,,,,,,,,,"The sequential subset of Erlang supports eager evaluation, single assignment, and dynamic typing.",,,Haskell features a type system with type inference and lazy evaluation.,3,,,,,,,,,,,,,,,,,,No,Yes,,Yes,,You're gonna need a bigger boat.,No,,"Mr. Gorbachev, open this gate! Mr. Gorbachev, tear down this wall!",Yes,Yes,,,,,,,,,,,,,,,,,,,,,,,"Haskell is a standardized, general-purpose purely functional programming language, with non-strict semantics and strong static typing.",No,Yes,Yes,,Yes,Yes,Yes,No,Yes,,No,Yes,,No,Yes,Yes,,hdfs://dnt01/ons/covserolink/landing_zone/responses_v0/ONS_Datafile_20211108.csv,,,,,,,,,,,,,,,,,,,,,,,,,,,,,,,,,,,,,,,,,,,,,,,,,,,,,,,,,,,,,,,,,Yes,Yes,No,Yes,Yes,,Yes,Yes,,Yes,,Yes,Yes,,2
148134381103,DHVF-7378598311,Dispatched,Patient did not attend,Completed,Swab / blood process to distressing,First Visit,,Fingerprick and Swab,2022-01-02 14:37:02,Ballyclare,,Cheshire,,,Swab Only,,,,,At least one person consented,,3,8,7,0,2,2,,6,Yes,79,57,56,,3,79,3,6,26.0,"Here's looking at you, kid.",69.0,You're gonna need a bigger boat.,36.0,"Elementary, my dear Watson.",61.0,"Get your stinking paws off me, you damned dirty ape.",,A census taker once tried to test me. I ate his liver with some fava beans and a nice Chianti.,,Let them eat cake.,,"Here's looking at you, kid.",,"Houston, we have a problem.",,The only thing we have to fear is fear itself.,DHR-015726397424,,,Mrs.,Jere,Cristobal,Johnston,2018-10-07 14:06:00,,No,No,No,Paper(Post),false,0,,No,Two attempts made,Other,ONS84060153,,ONS07714528,2022-01-08 09:42:06,Male,Female,Mixed/Multiple Ethnic Groups,Other ethnic group-Arab,Ports are created with the built-in function open_port.,No,Yes,Yes,Yes,Yes,,,No,Yes,Yes,,Yes,True,Yes,True,No,False,WHERE ARE MY PANTS?,ATOMS CAN CONTAIN ANY CHARACTER IF THEY ARE ENCLOSED WITHIN SINGLE QUOTES AND AN ESCAPE CONVENTION EXISTS WHICH ALLOWS ANY CHARACTER TO BE USED WITHIN AN ATOM,Social care,Do you come here often?,Yes,"Primary care (e.g. GP, dentist)",No,,Not at all,Yes,"Yes, vape/e-cigarettes",Pipe,,Yes,No,Yes,,No,Employed and currently working (including if on leave or sick leave for less than 4 weeks),No,Yes,Both (work from home and work somewhere else),,,,,,,,No,No,Yes,Yes,No,No,Yes,Yes,,,Yes,No,,No,,,Living in your own home,No,,,,,No,Participant Would Not/Could Not Answer,No,Yes,"[18, 5, 3, 12, 5, 18, 20, 23]",0,6-10,6-10,6-10,Participant Would Not/Could Not Answer,6-10,6,,,7 times or more,None,Yes,My face is already covered for other reasons (e.g. religious or cultural reasons),Yes always,Participant Would Not/Could Not Answer,No,Yes,No,No,No,,,Yes,No,No,No,Yes,Yes,No,,2022-01-02 00:00:00,,,,No,,No,One or more negative tests but none were positive,,,No,All tests failed,In the NHS (e.g. GP or hospital),2022-01-04 00:00:00,,No,Yes a lot,Vertigo/dizziness,No,,,,Yes,No,Yes,No,,No,No,,,Yes,No,Yes,,Yes,No,Yes,No,No,No,Sinovac,OtherVaxx,3 or more,,,No,Ecuador,2020-07-11 00:00:00,,hdfs://dnt01/ons/covserolink/landing_zone/responses_v2/ONSECRF5_Datafile_20211108.csv,DHR-0157263974242022-01-02 14:37:02,1.0,,2022-01-02,2022-01-08,2018-10-07,yes,yes,,,3.0,2-11,,2-11,2-4,,<=15y,No,,,,,,,,,,,,,,,No,2
983206377751,DVH-3615680014,,,,Too many visits,First Visit,,,2022-01-09 00:10:51,,,Staffordshire,WM0Q 7SI,,Swab Only,,You're gonna need a bigger boat.,,They call me *Mister* Tibbs!,,No,6,,2,1,1,0,7,,,69,,72,5,23,,69,84,82.0,I'm gonna make him an offer he can't refuse.,32.0,Let them eat cake.,,"Frankly, my dear, I don't give a damn.",86.0,"One morning I shot an elephant in my pajamas. How he got in my pajamas, I don't know.",32.0,A census taker once tried to test me. I ate his liver with some fava beans and a nice Chianti.,46.0,"Frankly, my dear, I don't give a damn.",22.0,A census taker once tried to test me. I ate his liver with some fava beans and a nice Chianti.,9.0,"Frankly, my dear, I don't give a damn.",1.0,"Get your stinking paws off me, you damned dirty ape.",DHR-718168598624,,,Sir,Martin,,Stephenson,,,,,,,,0,1,,,,ONS46387619,1,ONS43821442,2022-01-01 21:18:58,Male,Male,,White-Gypsy or Irish Traveller,"They are written as strings of consecutive alphanumeric characters, the first character being lowercase.",1,0,,0,0,,,0,,0,,,,,,,,Ports are created with the built-in function open_port.,"The syntax {D1,D2,...,Dn} denotes a tuple whose arguments are D1, D2, ... Dn.","She spent her earliest years reading classic literature, and writing poetry.","""Messages can be sent to and received from ports, but these messages must obey the so-called """"port protocol.""""""",No,No,Yes,,Yes,Yes,Ports are used to communicate with the external world.,,,No,No,,Yes,,"Houston, we have a problem.",,,"Frankly, my dear, I don't give a damn.",A census taker once tried to test me. I ate his liver with some fava beans and a nice Chianti.,"One morning I shot an elephant in my pajamas. How he got in my pajamas, I don't know.",No,No,Tuples are containers for a fixed number of Erlang data types.,,,Yes,No,Yes,,,No,No,,Yes,Yes,,"The Galactic Empire is nearing completion of the Death Star, a space station with the power to destroy entire planets.",,Yes,No,,"Frankly, my dear, I don't give a damn.",,,"Get your stinking paws off me, you damned dirty ape.",,,,Yes,No,,2,No,,No,Yes,,No,Yes,No,5,,,,No,,,,No,No,Yes,No,No,Yes,No,,No,No,No,No,No,Yes,,,,,Yes,,,,,,Yes,Negative,"Houston, we have a problem.",,,,,,,,,,,,,,,,,,,,,,,,,,,,No,,,,,hdfs://dnt01/ons/covserolink/landing_zone/responses_v1/ONSECRF4_Datafile_20211108.csv,Yes,,,,,,,,,,,,,,,,,,,,,,,,,,,,,,,,,,,,,,1
179939906992,DHVF-6842202103,,Patient did not attend,,Participant does not want to self swab,Follow-up Visit,,,2022-01-02 20:46:19,,Brigg,Clwyd,RG1X 2PQ,"Mr. Gorbachev, open this gate! Mr. Gorbachev, tear down this wall!",,,You're gonna need a bigger boat.,,"One morning I shot an elephant in my pajamas. How he got in my pajamas, I don't know.",,,0,2,6,8,8,2,6,3,No,44,49,64,56,22,48,4,65,70.0,"Mr. Gorbachev, open this gate! Mr. Gorbachev, tear down this wall!",,"""You've got to ask yourself one question: """"Do I feel lucky?"""" Well, do ya? Punk!""",85.0,"One morning I shot an elephant in my pajamas. How he got in my pajamas, I don't know.",86.0,"One morning I shot an elephant in my pajamas. How he got in my pajamas, I don't know.",43.0,A census taker once tried to test me. I ate his liver with some fava beans and a nice Chianti.,88.0,Those who refuse to learn from history are condemned to repeat it.,59.0,"Get your stinking paws off me, you damned dirty ape.",8.0,Let them eat cake.,49.0,Let them eat cake.,DHR-798435148661,B,Leeanne Soto,,,,,1989-05-06 05:20:00,aborter1991@gsnail.ac.uk,,,,,,1,0,,,,ONS26377891,0,ONS70220212,2022-01-09 06:38:28,,,,Any other Mixed background,,0,1,,1,0,,,0,,0,,,,,,,,I don't even care.,"The sequential subset of Erlang supports eager evaluation, single assignment, and dynamic typing.",,,,No,,,,,,,,,,,,,Any element of a tuple can be accessed in constant time.,,,Ports are created with the built-in function open_port.,4,,,,,,,,,,,,,,,,,,Yes,,No,No,,The only thing we have to fear is fear itself.,No,,You're gonna need a bigger boat.,Yes,,,,,,,,,,,,,,,,,,,,,,No,,I don't even care.,,No,No,,Yes,Yes,,,No,No,,,,Yes,Yes,Yes,,hdfs://dnt01/ons/covserolink/landing_zone/responses_v0/ONS_Datafile_20211108.csv,,,,,,,,,,,,,,,,,,,,,,,,,,,,,,,,,,,,,,,,,,,,,,,,,,,,,,,,,,,,,,,,Yes,,No,No,Yes,Yes,No,,No,No,No,,,No,,2
308444936021,DHVF-7986777862,Household did not attend,Re-scheduled,Active,Bad experience with tester / survey,First Visit,Month 11,Blood and Swab,2022-01-08 07:26:03,Dundrum,Thame,County Fermanagh,MX0C 6BH,,Blood and Swab,,,,,At least one person consented,Yes,4,6,1,8,1,1,7,1,No,14,78,,46,50,86,,96,79.0,Mama always said life was like a box of chocolates. You never know what you're gonna get.,45.0,Those who refuse to learn from history are condemned to repeat it.,70.0,"One morning I shot an elephant in my pajamas. How he got in my pajamas, I don't know.",100.0,"Houston, we have a problem.",,"Frankly, my dear, I don't give a damn.",21.0,You're gonna need a bigger boat.,,Those who refuse to learn from history are condemned to repeat it.,24.0,The only thing we have to fear is fear itself.,,"Frankly, my dear, I don't give a damn.",DHR-761161493200,,,Ms.,Oswaldo,Sherley,Parsons,1986-10-02 14:38:00,,No,Yes,Yes,Paper(Post),true,1,,Yes,Participant time constraints,Participant refused,ONS26377891,,ONS21954781,2022-01-09 14:48:12,,Male,Asian or Asian British,Any other Asian background,Tuples are containers for a fixed number of Erlang data types.,Yes,Yes,No,Yes,No,,Yes,Yes,No,No,,No,False,Yes,True,Yes,False,WHERE ARE MY PANTS?,I DON'T EVEN CARE,Armed forces,"The syntax {D1,D2,...,Dn} denotes a tuple whose arguments are D1, D2, ... Dn.",,Other healthcare (e.g. mental health),No,,"Yes, a lot",Yes,"Yes,  cigarettes",Hookah/shisha pipes,Yes,Yes,No,No,,,Attending university (including if temporarily absent)Self-employed and currently working (include if on leave or sick leave for less than 4 weeks),No,Yes,Somewhere else (not your home),2,Bicycle,Difficult to maintain 2 meters - but I can usually be at least 1m from other people,No,Fever,2022-01-06 00:00:00,No,Yes,No,Yes,Yes,No,No,Yes,,No,Yes,No,,,,Yes,,Living in your own home,No,,Living in your own home,,,No,,Participant Would Not/Could Not Answer,,"[21, 8, 3, 19, 21, 0, 1, 10]",Participant Would Not/Could Not Answer,6-10,1-5,,,21 or more,,,4,2,6,No,,,Never,,,Maybe,No,No,,No,Yes,,Yes,,Yes,No,Yes,,,No,,,No,,No,One or more negative tests but none positive,2022-01-06 00:00:00,2022-01-01 00:00:00,Yes,One or more negative tests but none were positive,,2022-01-03 00:00:00,2022-01-04 00:00:00,No,Yes a little,Cough,Yes,No,Yes,Yes,No,No,,No,No,No,No,,No,,No,No,Yes,No,,No,Yes,,,Sputnik,,1,,,Yes,Ecuador,,Yes,hdfs://dnt01/ons/covserolink/landing_zone/responses_v2/ONSECRF5_Datafile_20211108.csv,DHR-7611614932002022-01-08 07:26:03,1.0,,2022-01-08,2022-01-09,1986-10-02,yes,yes,MX0C,,35.0,20-49,16-49,35-49,35-39,,,No,,,,,,,,,,,,,,,No,2
904933340583,DVH-7417416665,,Patient did not attend,,Bad experience with tester / survey,Follow-up Visit,,,2022-01-01 18:09:00,Coolermoney,,Kent,TI1Z 1ZW,,Swab Only,,You're gonna need a bigger boat.,,Those who refuse to learn from history are condemned to repeat it.,,,4,3,3,2,1,5,0,4,,72,9,,,18,27,62,64,91.0,You're gonna need a bigger boat.,68.0,"Frankly, my dear, I don't give a damn.",0.0,"Mr. Gorbachev, open this gate! Mr. Gorbachev, tear down this wall!",75.0,The only thing we have to fear is fear itself.,37.0,You're gonna need a bigger boat.,53.0,"One morning I shot an elephant in my pajamas. How he got in my pajamas, I don't know.",43.0,"Frankly, my dear, I don't give a damn.",70.0,"""You've got to ask yourself one question: """"Do I feel lucky?"""" Well, do ya? Punk!""",36.0,"One morning I shot an elephant in my pajamas. How he got in my pajamas, I don't know.",DHR-008370830333,,,Ms.,Jackson,,Prince,,grouse1899@gsnail.ac.uk,,,,,,1,1,,,,ONS63959191,1,ONS05581901,2022-01-07 12:03:44,Female,Female,,White-British,Do you have any idea why this is not working?,1,0,,1,0,,,0,,0,,,,,,,,Do you come here often?,Its main implementation is the Glasgow Haskell Compiler.,Atoms can contain any character if they are enclosed within single quotes and an escape convention exists which allows any character to be used within an atom.,"They are written as strings of consecutive alphanumeric characters, the first character being lowercase.",Yes,,,No,No,,Any element of a tuple can be accessed in constant time.,,Yes,No,Yes,No,No,Yes,Ask not what your country can do for you; ask what you can do for your country.,,,The only thing we have to fear is fear itself.,They call me *Mister* Tibbs!,Ask not what your country can do for you; ask what you can do for your country.,,Yes,Any element of a tuple can be accessed in constant time.,,,,No,No,No,,,Yes,Yes,Yes,Yes,,Atoms are used within a program to denote distinguished values.,,,Yes,,A census taker once tried to test me. I ate his liver with some fava beans and a nice Chianti.,Yes,,"Here's looking at you, kid.",,,,,Yes,,5,No,,No,No,,,No,Yes,5,,,,Yes,,,,No,No,,,No,No,,No,Yes,,Yes,,,No,,Yes,,,No,,Yes,No,,,Yes,Positive,"Get your stinking paws off me, you damned dirty ape.",,,,,,,,,,,,,,,,,,,,,,,,,,,,Yes,,,,,hdfs://dnt01/ons/covserolink/landing_zone/responses_v1/ONSECRF4_Datafile_20211108.csv,,,,,,,,,,,,,,,,,,,,,,,,,,,,,,,,,,,,,,,2
481017294668,DHVF-7059050697,Household did not attend,Re-scheduled,Active,Participant does not want to self swab,First Visit,Follow-up 1,,2022-01-06 08:48:13,,Selkirk,,,,Blood and Swab,,,,,Invited,,0,6,2,2,0,8,0,3,No,24,,78,89,44,10,52,85,17.0,"Mr. Gorbachev, open this gate! Mr. Gorbachev, tear down this wall!",,"Get your stinking paws off me, you damned dirty ape.",,Let them eat cake.,,"Get your stinking paws off me, you damned dirty ape.",46.0,Those who refuse to learn from history are condemned to repeat it.,100.0,They call me *Mister* Tibbs!,,"One morning I shot an elephant in my pajamas. How he got in my pajamas, I don't know.",,"Get your stinking paws off me, you damned dirty ape.",,A census taker once tried to test me. I ate his liver with some fava beans and a nice Chianti.,DHR-943438989630,,,Dr.,France,Charise,Michael,,,Yes,,,Email,true,0,,,Participant refused to give blood on this visit,Non-contact visit. Household self-isolating,ONS63959191,,,,Female,Male,Mixed/Multiple Ethnic Groups,Asian or Asian British-Chinese,Ports are used to communicate with the external world.,Yes,No,No,Yes,No,Yes,Yes,Yes,,Yes,Yes,No,False,Yes,False,No,True,ATOMS CAN CONTAIN ANY CHARACTER IF THEY ARE ENCLOSED WITHIN SINGLE QUOTES AND AN ESCAPE CONVENTION EXISTS WHICH ALLOWS ANY CHARACTER TO BE USED WITHIN AN ATOM,IT IS ALSO A GARBAGE-COLLECTED RUNTIME SYSTEM,Financial Services (incl. insurance),"The syntax {D1,D2,...,Dn} denotes a tuple whose arguments are D1, D2, ... Dn.",Yes,,No,No,Not at all,No,,Pipe,Yes,No,Yes,No,,,,Yes,,Somewhere else (not your home),5,Car or Van,Very difficult to be more than 1 meter away as my work means I am in close contact with others on a regular basis,Yes,Fever,,No,Yes,Yes,,,,,Yes,Yes,No,No,No,,,Yes,Yes,2022-01-07 00:00:00,,,,Outside your home,,,Yes,Participant Would Not/Could Not Answer,Yes,Yes,"[8, 7, 2, 10, 16, 17, 21, 3]",1-5,,1-5,,0,,5,2,2,0,1,No,Yes at work/school only,Not going to place of work or education,My face is already covered for other reasons (e.g. religious or cultural reasons),Yes,No,No,No,,No,No,,No,Yes,No,Yes,Yes,,,2022-01-09 00:00:00,No,,,No,,Yes,Waiting for all results,,,,One or more negative tests but none were positive,In the NHS (e.g. GP or hospital),,2022-01-07 00:00:00,Yes,,Chest pain,No,No,,,No,No,,Yes,,No,No,Yes,,No,No,,Yes,No,Yes,Yes,,No,,Oxford/AstraZeneca,,3 or more,,,No,Afghanistan,,Yes,hdfs://dnt01/ons/covserolink/landing_zone/responses_v2/ONSECRF5_Datafile_20211108.csv,DHR-9434389896302022-01-06 08:48:13,1.0,,2022-01-06,,,no,yes,,,,,,,,,,No,,,,,,,,,,,,,,,No,2
047199722481,DVH-1570689766,Completed,,Completed,,First Visit,,Blood and Swab,2022-01-08 17:32:46,Donnybrewer,Narberth,,DS0O 6ID,,Blood and Swab,,,,,At least one person consented,Yes,6,0,8,5,,4,7,3,No,9,27,51,29,62,12,27,,64.0,"""You've got to ask yourself one question: """"Do I feel lucky?"""" Well, do ya? Punk!""",38.0,Let them eat cake.,44.0,A census taker once tried to test me. I ate his liver with some fava beans and a nice Chianti.,,Let them eat cake.,,"One morning I shot an elephant in my pajamas. How he got in my pajamas, I don't know.",,I'm gonna make him an offer he can't refuse.,72.0,Those who refuse to learn from history are condemned to repeat it.,,The only thing we have to fear is fear itself.,,They call me *Mister* Tibbs!,DHR-007971389500,,,,Shemika,Tommy,Chan,1985-09-24 11:03:00,,No,,No,Email,false,0,,Yes,Other,Participant felt unwell/fainted,ONS72433775,,ONS93008687,2022-01-01 05:58:38,Male,,White,White-Gypsy or Irish Traveller,Where are my pants?,Yes,No,Yes,Yes,No,No,Yes,No,,Yes,Yes,No,False,,False,Yes,False,"THEY ARE WRITTEN AS STRINGS OF CONSECUTIVE ALPHANUMERIC CHARACTERS, THE FIRST CHARACTER BEING LOWERCASE",ERLANG IS KNOWN FOR ITS DESIGNS THAT ARE WELL SUITED FOR SYSTEMS,Other occupation sector,Atoms are used within a program to denote distinguished values.,Yes,Secondary care (e.g. hospital),Yes,No,"Yes, a lot",No,"Yes, cigar",,,Yes,No,No,,Yes,5y and older in full-time education,No,,Somewhere else (not your home),7,Car or Van,,No,Muscle ache,,No,Yes,Yes,,No,,No,Yes,No,Yes,No,Yes,,,No,,,,No,,,,,No,Yes,Yes,Participant Would Not/Could Not Answer,"[12, 20, 23, 7, 8, 16, 19, 12]",1-5,0,,,21 or more,1-5,3,1,7 times or more,0,3,Yes,Yes in other situations only (including public transport/shops),Not going to place of work or education,Not going to other enclosed public spaces or using public transport,Yes,Yes,Maybe,No,Yes,Yes,Yes,No,,No,,,No,,Yes,,Yes,,,Yes,,,,,2022-01-03 00:00:00,,One or more positive test(s),Participant Would Not/Could Not Answer,,2022-01-05 00:00:00,,Yes a little,Abdominal pain,No,,Yes,Yes,Yes,No,No,Yes,Yes,,No,No,No,Yes,Yes,No,Yes,Yes,,Yes,,No,No,Sinovac,OtherVaxx,,2022-01-02 00:00:00,,Yes,Qatar,,Yes,hdfs://dnt01/ons/covserolink/landing_zone/responses_v2/ONSECRF5_Datafile_20211108.csv,DHR-0079713895002022-01-08 17:32:46,1.0,,2022-01-08,2022-01-01,1985-09-24,yes,yes,DS0O,,36.0,20-49,16-49,35-49,35-39,,,No,,,,,,,,,,,,,,,No,3
