808324608194,DHVF-8513518801,,Patient did not attend,,Bad experience with tester / survey,Follow-up Visit,,,2022-01-05 11:24:42,,,County Fermanagh,YD1C 5HP,Mama always said life was like a box of chocolates. You never know what you're gonna get.,,,"Houston, we have a problem.",3.0,Let them eat cake.,,No,0,3,1,2,5,1,3,4,No,63,75,59,15,15,44,49,5,,I'm gonna make him an offer he can't refuse.,86.0,"One morning I shot an elephant in my pajamas. How he got in my pajamas, I don't know.",70.0,Mama always said life was like a box of chocolates. You never know what you're gonna get.,77.0,"Houston, we have a problem.",65.0,"Get your stinking paws off me, you damned dirty ape.",,"Get your stinking paws off me, you damned dirty ape.",34.0,I'm gonna make him an offer he can't refuse.,61.0,They call me *Mister* Tibbs!,44.0,They call me *Mister* Tibbs!,DHR-882497285610,J,Veronique Rodgers,,,,,,verdurer2043@gsnail.ac.uk,,,,,,0,0,,,,ONS10529561,0,ONS00167403,2022-01-09 19:08:07,Male,Male,,"Black,Caribbean,Afro-Caribbean",,1,1,,0,1,,,0,,0,,,,,,,,"The syntax {D1,D2,...,Dn} denotes a tuple whose arguments are D1, D2, ... Dn.",He looked inquisitively at his keyboard and wrote another sentence.,,,,,,,,,,,,,,,,,Erlang is known for its designs that are well suited for systems.,,,"Erlang is a general-purpose, concurrent, functional programming language.",2,,,,,,,,,,,,,,,,,,Yes,Yes,Yes,Yes,,A census taker once tried to test me. I ate his liver with some fava beans and a nice Chianti.,No,,I'm gonna make him an offer he can't refuse.,No,,,,,,,,,,,,,,,,,,,,,,No,,The arguments can be primitive data types or compound data types.,Yes,Yes,No,,,No,Yes,Yes,No,,No,No,,No,Yes,Yes,No,hdfs://dnt01/ons/covserolink/landing_zone/responses_v0/ONS_Datafile_20211108.csv,,,,,,,,,,,,,,,,,,,,,,,,,,,,,,,,,,,,,,,,,,,,,,,,,,,,,,,,,,,,,,,No,,No,No,Yes,No,,,Yes,No,Yes,No,Yes,No,No,,2
366331010982,DVH-6646713440,Dispatched,Patient did not attend,Completed,No longer wants to take part,First Visit,Month 12,Blood and Swab,2022-01-02 07:52:58,Glenhone,,,,,Blood and Swab,,,,,,Yes,3,8,,1,,5,8,3,Yes,,44,87,34,73,71,59,66,12.0,Mama always said life was like a box of chocolates. You never know what you're gonna get.,,A census taker once tried to test me. I ate his liver with some fava beans and a nice Chianti.,68.0,"Frankly, my dear, I don't give a damn.",2.0,They call me *Mister* Tibbs!,58.0,Ask not what your country can do for you; ask what you can do for your country.,,"One morning I shot an elephant in my pajamas. How he got in my pajamas, I don't know.",81.0,Mama always said life was like a box of chocolates. You never know what you're gonna get.,,"Get your stinking paws off me, you damned dirty ape.",,"Get your stinking paws off me, you damned dirty ape.",DHR-006798755244,,,Mrs.,Ellyn,Deon,Blackburn,1989-05-07 23:48:00,,,No,No,Email,false,0,,Yes,Participant felt unwell/fainted,Non-contact visit. Household self-isolating,ONS10529561,,ONS57129557,,Female,Prefer not to say,Mixed/Multiple Ethnic Groups,White-Irish,Erlang is known for its designs that are well suited for systems.,Yes,Yes,No,Yes,Yes,Yes,No,No,Yes,No,No,,False,No,False,Yes,False,"THEY ARE WRITTEN AS STRINGS OF CONSECUTIVE ALPHANUMERIC CHARACTERS, THE FIRST CHARACTER BEING LOWERCASE","ERLANG IS A GENERAL-PURPOSE, CONCURRENT, FUNCTIONAL PROGRAMMING LANGUAGE",Retail sector (incl. wholesale),I don't even care.,,,,,"Yes, a little",No,,Cigarettes,,Yes,No,No,,,Attending university (including if temporarily absent)Self-employed and currently working (include if on leave or sick leave for less than 4 weeks),,,Both (work from home and work somewhere else),5,Bus,Difficult to maintain 2 meters - but I can usually be at least 1m from other people,Yes,Fever,2022-01-01 00:00:00,Yes,No,No,No,No,,Yes,No,,No,,Yes,Participant Would Not/Could Not Answer,,,No,2022-01-01 00:00:00,,Yes,,Outside your home,,,Yes,No,,No,"[14, 14, 16, 19, 11, 17, 12, 10]",0,Participant Would Not/Could Not Answer,21 or more,,Participant Would Not/Could Not Answer,6-10,,3,3,7 times or more,5,No,Yes in other situations only (including public transport or shops),Yes sometimes,Yes always,Yes,,,No,No,Yes,No,No,No,Yes,Yes,No,Yes,Yes,No,2022-01-08 00:00:00,,,,No,,,One or more positive test(s),2022-01-02 00:00:00,2022-01-08 00:00:00,Yes,One or more negative tests but none were positive,Home Test,2022-01-01 00:00:00,2022-01-06 00:00:00,No,,,No,No,,No,Yes,Yes,,No,,Yes,No,No,,,,,No,No,,Yes,Yes,,,Janssen/Johnson&Johnson,,2,2022-01-05 00:00:00,,Yes,Namibia,2022-07-20 00:00:00,Yes,hdfs://dnt01/ons/covserolink/landing_zone/responses_v2/ONSECRF5_Datafile_20211108.csv,DHR-0067987552442022-01-02 07:52:58,1.0,,2022-01-02,,1989-05-07,yes,yes,,,32.0,20-49,16-49,25-34,30-34,,,No,,,,,,,,,,,,,,,No,2
891561736478,DVH-3261183658,,Scheduled,,Swab / blood process to distressing,Follow-up Visit,,,2022-01-04 09:17:13,,,,,,Swab Only,4.0,I'm gonna make him an offer he can't refuse.,,"Mr. Gorbachev, open this gate! Mr. Gorbachev, tear down this wall!",,Yes,4,5,1,0,1,3,1,7,No,44,19,76,,,14,3,5,16.0,Mama always said life was like a box of chocolates. You never know what you're gonna get.,55.0,The only thing we have to fear is fear itself.,1.0,They call me *Mister* Tibbs!,60.0,Mama always said life was like a box of chocolates. You never know what you're gonna get.,7.0,Let them eat cake.,91.0,"Houston, we have a problem.",15.0,Let them eat cake.,55.0,"Houston, we have a problem.",75.0,"""You've got to ask yourself one question: """"Do I feel lucky?"""" Well, do ya? Punk!""",DHR-359410769701,,,PhD,Kenisha,,Burke,1988-06-30 19:20:00,profaners1879@gsnail.ac.uk,,,,,,1,1,,,,ONS86545784,0,ONS95980765,2022-01-06 07:34:07,Male,Male,,Any other ethnic group,"Initially composing light-hearted and irreverent works, he also wrote serious, sombre and religious pieces beginning in the 1930s.",0,0,,1,0,,,0,,0,,,,,,,,Any element of a tuple can be accessed in constant time.,"They are written as strings of consecutive alphanumeric characters, the first character being lowercase.",I don't even care.,"""Messages can be sent to and received from ports, but these messages must obey the so-called """"port protocol.""""""",Yes,,Yes,,Yes,Yes,It is also a garbage-collected runtime system.,,No,No,,,,No,I'm gonna make him an offer he can't refuse.,,,Let them eat cake.,"Elementary, my dear Watson.","One morning I shot an elephant in my pajamas. How he got in my pajamas, I don't know.",Yes,No,Where are my pants?,,Yes,,No,,Yes,Yes,No,No,No,,Yes,No,The arguments can be primitive data types or compound data types.,,,,,"Houston, we have a problem.",,,Let them eat cake.,,,,Yes,No,,1,No,,No,Yes,No,,Yes,No,6,,,,Yes,,,No,Yes,,,,Yes,Yes,,,Yes,Yes,Yes,Yes,Yes,No,,No,,,No,,Yes,Yes,,,,Negative,"One morning I shot an elephant in my pajamas. How he got in my pajamas, I don't know.",,,,,,,,,,,,,,,,,,,,,,,,,,,,No,,,,,hdfs://dnt01/ons/covserolink/landing_zone/responses_v1/ONSECRF4_Datafile_20211108.csv,Yes,No,,,,,,,,,,,,,,,,,,,,,,,,,,,,,,,,,,,,,5
100744906447,DVH-6415543165,,Re-scheduled,,Swab / blood process to distressing,Follow-up Visit,,,2022-01-09 12:11:56,Beersbridge,,Norfolk,,,Swab Only,,"Frankly, my dear, I don't give a damn.",0.0,"One morning I shot an elephant in my pajamas. How he got in my pajamas, I don't know.",,No,4,,2,0,6,7,5,8,No,12,40,26,,21,59,31,30,64.0,The only thing we have to fear is fear itself.,40.0,They call me *Mister* Tibbs!,12.0,The only thing we have to fear is fear itself.,15.0,Let them eat cake.,44.0,"""You've got to ask yourself one question: """"Do I feel lucky?"""" Well, do ya? Punk!""",70.0,I'm gonna make him an offer he can't refuse.,,"""You've got to ask yourself one question: """"Do I feel lucky?"""" Well, do ya? Punk!""",41.0,"Houston, we have a problem.",85.0,A census taker once tried to test me. I ate his liver with some fava beans and a nice Chianti.,DHR-461799740804,,,B.A.,Kip,,Garner,2013-04-21 07:03:00,bande1877@gsnail.ac.uk,,,,,,0,1,,,,ONS86545784,1,ONS39274499,2022-01-02 09:09:09,Male,Male,,Asian or Asian British-Pakistani,"She spent her earliest years reading classic literature, and writing poetry.",0,0,,0,0,,,0,,1,,,,,,,,"Erlang is a general-purpose, concurrent, functional programming language.","""Messages can be sent to and received from ports, but these messages must obey the so-called """"port protocol.""""""",Make me a sandwich.,Do you come here often?,No,Yes,Yes,No,,,Ports are created with the built-in function open_port.,,No,No,Yes,Yes,,,Those who refuse to learn from history are condemned to repeat it.,,,"Here's looking at you, kid.","One morning I shot an elephant in my pajamas. How he got in my pajamas, I don't know.",Mama always said life was like a box of chocolates. You never know what you're gonna get.,Yes,,"They are written as strings of consecutive alphanumeric characters, the first character being lowercase.",,,Yes,,Yes,No,,Yes,,No,No,No,Yes,Its main implementation is the Glasgow Haskell Compiler.,,Yes,No,,"Frankly, my dear, I don't give a damn.",,,Mama always said life was like a box of chocolates. You never know what you're gonna get.,,,,,No,,7,No,,No,,No,,No,,3,,,,No,,,Yes,No,,,No,Yes,No,,,No,No,No,,No,,,No,,,,,Yes,,,,,Positive,Those who refuse to learn from history are condemned to repeat it.,,,,,,,,,,,,,,,,,,,,,,,,,,,,Yes,,,,,hdfs://dnt01/ons/covserolink/landing_zone/responses_v1/ONSECRF4_Datafile_20211108.csv,No,,,,,,,,,,,,,,,,,,,,,,,,,,,,,,,,,,,,,,5
591872752764,DHVF-1000693616,,Cancelled,,,First Visit,,,2022-01-01 09:29:00,Cromac,,,ED5Z 5XV,,Blood and Swab,,Ask not what your country can do for you; ask what you can do for your country.,,Mama always said life was like a box of chocolates. You never know what you're gonna get.,,Yes,7,3,1,,8,,3,0,No,28,74,86,91,80,,85,17,34.0,Mama always said life was like a box of chocolates. You never know what you're gonna get.,89.0,"Frankly, my dear, I don't give a damn.",4.0,"Here's looking at you, kid.",17.0,Those who refuse to learn from history are condemned to repeat it.,72.0,"Get your stinking paws off me, you damned dirty ape.",4.0,The only thing we have to fear is fear itself.,80.0,"Here's looking at you, kid.",89.0,They call me *Mister* Tibbs!,19.0,"""You've got to ask yourself one question: """"Do I feel lucky?"""" Well, do ya? Punk!""",DHR-007772642385,,,B.E.,Demetrice,,Pratt,1999-12-04 20:58:00,,,,,,,0,0,,,,ONS86545784,1,ONS45123522,2022-01-06 19:20:07,Female,,,Mixed-White & Asian,"""Messages can be sent to and received from ports, but these messages must obey the so-called """"port protocol.""""""",0,0,,1,0,,,0,,1,,,,,,,,It is also a garbage-collected runtime system.,The arguments can be primitive data types or compound data types.,Where are my pants?,Ports are used to communicate with the external world.,No,No,Yes,,,,Ports are used to communicate with the external world.,,Yes,No,,Yes,Yes,,A census taker once tried to test me. I ate his liver with some fava beans and a nice Chianti.,,,"One morning I shot an elephant in my pajamas. How he got in my pajamas, I don't know.","Get your stinking paws off me, you damned dirty ape.","One morning I shot an elephant in my pajamas. How he got in my pajamas, I don't know.",No,Yes,Where are my pants?,,No,No,,,,No,No,Yes,Yes,Yes,,No,Haskell features a type system with type inference and lazy evaluation.,,No,No,,I'm gonna make him an offer he can't refuse.,Yes,,Mama always said life was like a box of chocolates. You never know what you're gonna get.,,,,,,,5,No,No,No,No,Yes,Yes,No,Yes,7,,,,No,,,No,No,Yes,No,No,,,Yes,,Yes,No,,Yes,No,,,,,,Yes,,No,,,,No,Negative,"Frankly, my dear, I don't give a damn.",,,,,,,,,,,,,,,,,,,,,,,,,,,,,,,,,hdfs://dnt01/ons/covserolink/landing_zone/responses_v1/ONSECRF4_Datafile_20211108.csv,Yes,,,,,,,,,,,,,,,,,,,,,,,,,,,,,,,,,,,,,,5
586133068919,DHVF-9635706236,,Scheduled,,Too many visits,Follow-up Visit,,,2022-01-01 22:07:27,,,,AF3W 9HQ,You're gonna need a bigger boat.,,,Ask not what your country can do for you; ask what you can do for your country.,,"Houston, we have a problem.",,,0,1,1,0,3,5,3,7,,,69,35,28,25,,55,71,78.0,The only thing we have to fear is fear itself.,27.0,Let them eat cake.,46.0,Those who refuse to learn from history are condemned to repeat it.,27.0,"Houston, we have a problem.",,"Get your stinking paws off me, you damned dirty ape.",87.0,Mama always said life was like a box of chocolates. You never know what you're gonna get.,10.0,I'm gonna make him an offer he can't refuse.,54.0,"Houston, we have a problem.",89.0,Let them eat cake.,DHR-385906188804,G,Gustavo Russell,,,,,2009-04-11 19:09:00,,,,,,,1,1,,,,ONS86545784,0,,2022-01-07 03:30:55,Female,Female,,Any other Black background,,1,0,,0,1,,,0,,1,,,,,,,,"In 1989 the building was heavily damaged by fire, but it has since been restored.",Any element of a tuple can be accessed in constant time.,,,,,,,,,,,,,,,,,Erlang is known for its designs that are well suited for systems.,,,Do you have any idea why this is not working?,5,,,,,,,,,,,,,,,,,,Yes,,No,Yes,,"Mr. Gorbachev, open this gate! Mr. Gorbachev, tear down this wall!",No,,"Get your stinking paws off me, you damned dirty ape.",Yes,,,,,,,,,,,,,,,,,,,,,,No,,"Haskell is a standardized, general-purpose purely functional programming language, with non-strict semantics and strong static typing.",No,,Yes,,No,,No,,Yes,No,No,Yes,,Yes,,Yes,Yes,hdfs://dnt01/ons/covserolink/landing_zone/responses_v0/ONS_Datafile_20211108.csv,,,,,,,,,,,,,,,,,,,,,,,,,,,,,,,,,,,,,,,,,,,,,,,,,,,,,,,,,,,,,,,,Yes,,,Yes,Yes,No,,No,Yes,,Yes,,,No,,5
675709173074,DVH-3645137591,,Completed,,,First Visit,,,2022-01-07 19:33:09,,,Gwynedd County,,A census taker once tried to test me. I ate his liver with some fava beans and a nice Chianti.,,,"Houston, we have a problem.",7.0,I'm gonna make him an offer he can't refuse.,,No,0,8,8,7,8,0,3,2,Yes,80,57,38,13,69,85,9,49,37.0,You're gonna need a bigger boat.,44.0,Mama always said life was like a box of chocolates. You never know what you're gonna get.,3.0,You're gonna need a bigger boat.,13.0,I'm gonna make him an offer he can't refuse.,63.0,You're gonna need a bigger boat.,,"""You've got to ask yourself one question: """"Do I feel lucky?"""" Well, do ya? Punk!""",30.0,Those who refuse to learn from history are condemned to repeat it.,68.0,Let them eat cake.,82.0,The only thing we have to fear is fear itself.,DHR-559379346512,V,Pearly Key,,,,,2011-01-03 12:32:00,retractor2005@gsnail.ac.uk,,,,,,1,0,,,,ONS86545784,1,ONS83639422,2022-01-01 21:12:53,,,,White-Irish,,0,0,,0,0,,,1,,1,,,,,,,,Haskell features a type system with type inference and lazy evaluation.,Erlang is known for its designs that are well suited for systems.,,,,No,,,,,,,,,,,,,"They are written as strings of consecutive alphanumeric characters, the first character being lowercase.",,,"They are written as strings of consecutive alphanumeric characters, the first character being lowercase.",6,,,,,,,,,,,,,,,,,,,,,No,,"One morning I shot an elephant in my pajamas. How he got in my pajamas, I don't know.",No,,Let them eat cake.,Yes,,,,,,,,,,,,,,,,,,,,,,No,,Type classes first appeared in the Haskell programming language.,No,No,Yes,No,,No,No,Yes,,,,No,,,No,Yes,,hdfs://dnt01/ons/covserolink/landing_zone/responses_v0/ONS_Datafile_20211108.csv,,,,,,,,,,,,,,,,,,,,,,,,,,,,,,,,,,,,,,,,,,,,,,,,,,,,,,,,,,,,,,,No,,Yes,,,Yes,,,No,Yes,Yes,No,Yes,Yes,No,,5
657236092480,DHVF-0399075152,,Patient did not attend,,Moving location,First Visit,,,2022-01-03 05:46:33,Greenhaw,,,,,Swab Only,,A census taker once tried to test me. I ate his liver with some fava beans and a nice Chianti.,,I'm gonna make him an offer he can't refuse.,,Yes,0,6,8,6,2,0,4,5,Yes,81,20,58,15,11,0,,43,34.0,A census taker once tried to test me. I ate his liver with some fava beans and a nice Chianti.,,A census taker once tried to test me. I ate his liver with some fava beans and a nice Chianti.,8.0,Mama always said life was like a box of chocolates. You never know what you're gonna get.,85.0,"Get your stinking paws off me, you damned dirty ape.",57.0,They call me *Mister* Tibbs!,,"""You've got to ask yourself one question: """"Do I feel lucky?"""" Well, do ya? Punk!""",64.0,"Houston, we have a problem.",11.0,They call me *Mister* Tibbs!,90.0,They call me *Mister* Tibbs!,DHR-617416346811,,,M.D.,Evelyne,,Zimmerman,2016-04-24 01:37:00,,,,,,,1,0,,,,ONS29309867,1,,2022-01-04 05:21:51,,Prefer not to say,,"Black,Caribbean,African-African","""Messages can be sent to and received from ports, but these messages must obey the so-called """"port protocol.""""""",1,0,,1,0,,,1,,1,,,,,,,,Atoms are used within a program to denote distinguished values.,"Initially composing light-hearted and irreverent works, he also wrote serious, sombre and religious pieces beginning in the 1930s.",It is also a garbage-collected runtime system.,Its main implementation is the Glasgow Haskell Compiler.,No,Yes,Yes,Yes,No,,I don't even care.,,,No,Yes,Yes,No,Yes,"""You've got to ask yourself one question: """"Do I feel lucky?"""" Well, do ya? Punk!""",,,They call me *Mister* Tibbs!,"""You've got to ask yourself one question: """"Do I feel lucky?"""" Well, do ya? Punk!""","Elementary, my dear Watson.",No,Yes,"Initially composing light-hearted and irreverent works, he also wrote serious, sombre and religious pieces beginning in the 1930s.",,No,,,,No,Yes,Yes,Yes,Yes,Yes,,No,"Initially composing light-hearted and irreverent works, he also wrote serious, sombre and religious pieces beginning in the 1930s.",,Yes,No,,Mama always said life was like a box of chocolates. You never know what you're gonna get.,Yes,,"Get your stinking paws off me, you damned dirty ape.",,,,No,No,,4,No,No,,No,Yes,,,No,2,,,,Yes,,,No,No,No,Yes,No,Yes,No,No,No,No,Yes,No,,Yes,Yes,,,,,,,Yes,Yes,,,No,Negative,"""You've got to ask yourself one question: """"Do I feel lucky?"""" Well, do ya? Punk!""",,,,,,,,,,,,,,,,,,,,,,,,,,,,Yes,,,,,hdfs://dnt01/ons/covserolink/landing_zone/responses_v1/ONSECRF4_Datafile_20211108.csv,,Yes,,,,,,,,,,,,,,,,,,,,,,,,,,,,,,,,,,,,,4
966991714420,DVH-3917494617,Household did not attend,Completed,Active,Bad experience with tester / survey,First Visit,Month 4,Fingerprick and Swab,2022-01-07 14:54:12,,Chepstow,,OZ3K 1DW,,Swab Only,,,,,Accepted,,0,5,6,2,6,5,7,,Yes,59,36,82,17,76,27,60,31,89.0,"One morning I shot an elephant in my pajamas. How he got in my pajamas, I don't know.",9.0,"""You've got to ask yourself one question: """"Do I feel lucky?"""" Well, do ya? Punk!""",79.0,"Mr. Gorbachev, open this gate! Mr. Gorbachev, tear down this wall!",,"Houston, we have a problem.",,"""You've got to ask yourself one question: """"Do I feel lucky?"""" Well, do ya? Punk!""",94.0,A census taker once tried to test me. I ate his liver with some fava beans and a nice Chianti.,,I'm gonna make him an offer he can't refuse.,,"Frankly, my dear, I don't give a damn.",83.0,Those who refuse to learn from history are condemned to repeat it.,DHR-644122693640,,,Miss.,Porfirio,Jerold,Strickland,2009-11-26 09:46:00,,,No,,Email,false,0,,No,Participant refused to give blood on this visit,Poor venous access,ONS29309867,,ONS39274499,,Female,Prefer not to say,Other Ethnic Group,Asian or Asian British-Pakistani,Tuples are containers for a fixed number of Erlang data types.,Yes,Yes,No,Yes,No,Yes,Yes,No,No,No,,Yes,True,No,False,,False,HE LOOKED INQUISITIVELY AT HIS KEYBOARD AND WROTE ANOTHER SENTENCE,TYPE CLASSES FIRST APPEARED IN THE HASKELL PROGRAMMING LANGUAGE,Retail Sector (incl. wholesale),"""Messages can be sent to and received from ports, but these messages must obey the so-called """"port protocol.""""""",,"Primary care (e.g. GP, dentist)",Yes,No,Not at all,,,Hookah/shisha pipes,No,,,,,Yes,5y and older in full-time education,No,No,From home (in the same grounds or building as your home)Somewhere else (not at your home),7,Other method,Very difficult to be more than 1 meter away as my work means I am in close contact with others on a regular basis,No,,,Yes,No,No,No,No,,,Yes,No,,,,Yes for other reasons (e.g. going into hospital or quarantining),,No,No,2022-01-06 00:00:00,,No,2022-01-07 00:00:00,,,,,Yes,Participant Would Not/Could Not Answer,,"[3, 7, 16, 16, 17, 17, 17, 6]",0,21 or more,0,1-5,,,2,4,0,1,6,Yes,Participant Would Not/Could Not Answer,Participant Would Not/Could Not Answer,Yes always,Yes,No,Yes,,,Yes,No,No,No,No,,,Yes,No,Yes,2022-01-02 00:00:00,Yes,,,Yes,,Yes,Waiting for all results,,,,One or more negative tests but none were positive,Private Lab,,2022-01-02 00:00:00,,Yes a lot,Difficulty concentrating,,No,No,,,,,,No,No,No,,Yes,No,Yes,No,Yes,No,No,No,Yes,Yes,No,Novavax,,2,2022-01-09 00:00:00,,,Gabon,2021-01-24 00:00:00,,hdfs://dnt01/ons/covserolink/landing_zone/responses_v2/ONSECRF5_Datafile_20211108.csv,DHR-6441226936402022-01-07 14:54:12,1.0,,2022-01-07,,2009-11-26,yes,yes,OZ3K,,12.0,12-19,,12-16,10-14,9.0,<=15y,No,,,,,,,,,,,,,,,No,4
375362381715,DHVF-2701528899,Withdrawn,Scheduled,Completed,No longer convenient,First Visit,,Blood and Swab,2022-01-06 02:58:40,,,,,,Blood and Swab,,,,,Declined,Yes,1,6,5,2,2,,8,5,Yes,82,1,24,85,11,,63,13,93.0,You're gonna need a bigger boat.,36.0,"Elementary, my dear Watson.",56.0,They call me *Mister* Tibbs!,12.0,Ask not what your country can do for you; ask what you can do for your country.,91.0,"Mr. Gorbachev, open this gate! Mr. Gorbachev, tear down this wall!",62.0,Those who refuse to learn from history are condemned to repeat it.,4.0,They call me *Mister* Tibbs!,36.0,"Mr. Gorbachev, open this gate! Mr. Gorbachev, tear down this wall!",,Those who refuse to learn from history are condemned to repeat it.,DHR-847904950561,,,Dr.,Shantelle,Hoyt,Mcintyre,1992-08-11 05:25:00,occipitoiliac1990@gsnail.ac.uk,Yes,,No,Paper(Post),true,0,,No,Participant felt unwell/fainted,Poor venous access,ONS29309867,,ONS75750309,,Female,Male,White,Mixed-White & Black African,It is also a garbage-collected runtime system.,No,No,No,No,No,,No,Yes,,Yes,Yes,,True,,False,No,True,PORTS ARE USED TO COMMUNICATE WITH THE EXTERNAL WORLD,WHERE ARE MY PANTS?,Other occupation sector (specify),"""Messages can be sent to and received from ports, but these messages must obey the so-called """"port protocol.""""""",,Secondary care (e.g. hospital),,Yes,"Yes, a lot",,"Yes, cigar",Cigarettes,Yes,No,No,,,No,Attending university (including if temporarily absent)Self-employed and currently working (include if on leave or sick leave for less than 4 weeks),Yes,,Both (work from home and work somewhere else),5,Car or Van,Difficult to maintain 2 meters - but I can usually be at least 1m from other people,,,2022-01-03 00:00:00,Yes,No,No,,Yes,Yes,,No,No,Yes,No,No,Yes for other reasons (e.g. going into hospital or quarantining),,Yes,,2022-01-05 00:00:00,Outside your home,Yes,2022-01-02 00:00:00,,,,No,,,Yes,"[1, 13, 19, 16, 17, 9, 16, 20]",11-20,Participant Would Not/Could Not Answer,,21 or more,Participant Would Not/Could Not Answer,,7 times or more,Participant Would Not/Could Not Answer,Participant Would Not/Could Not Answer,6,6,Yes,Yes usually both at work/school and in other situations,Yes always,Yes sometimes,,,,Yes,No,Yes,,,Yes,,,Yes,Yes,Yes,No,,Yes,,,Yes,,No,,,2022-01-09 00:00:00,,All tests failed,Participant Would Not/Could Not Answer,2022-01-09 00:00:00,,Yes,Yes a lot,Diarrhoea,,,,Yes,No,,No,,Yes,,,No,,Yes,,No,No,,,Yes,Yes,Yes,,Janssen/Johnson&Johnson,,1,,,Yes,Pakistan,2022-12-21 00:00:00,Yes,hdfs://dnt01/ons/covserolink/landing_zone/responses_v2/ONSECRF5_Datafile_20211108.csv,DHR-8479049505612022-01-06 02:58:40,1.0,False,2022-01-06,,1992-08-11,yes,yes,,,29.0,20-49,16-49,25-34,25-29,,,No,,,,,,,,,,,,,,,No,4
025555437553,DVH-0149191342,,Cancelled,,No longer convenient,Follow-up Visit,,,2022-01-01 19:42:30,Ballypollard,,,,"Frankly, my dear, I don't give a damn.",,,"Get your stinking paws off me, you damned dirty ape.",,I'm gonna make him an offer he can't refuse.,,No,0,6,8,4,2,8,4,5,No,38,33,57,18,85,64,89,22,50.0,Ask not what your country can do for you; ask what you can do for your country.,8.0,Mama always said life was like a box of chocolates. You never know what you're gonna get.,83.0,"Houston, we have a problem.",10.0,The only thing we have to fear is fear itself.,45.0,A census taker once tried to test me. I ate his liver with some fava beans and a nice Chianti.,46.0,They call me *Mister* Tibbs!,76.0,The only thing we have to fear is fear itself.,22.0,Mama always said life was like a box of chocolates. You never know what you're gonna get.,35.0,The only thing we have to fear is fear itself.,DHR-619211592416,L,Johana Swanson,,,,,,saltire1942@gsnail.ac.uk,,,,,,1,1,,,,ONS29309867,1,ONS57129557,2022-01-04 17:37:39,,Prefer not to say,,Any other white background,,1,0,,1,1,,,0,,1,,,,,,,,The arguments can be primitive data types or compound data types.,"The sequential subset of Erlang supports eager evaluation, single assignment, and dynamic typing.",,,,Yes,,,,,,,,,,,,,"Initially composing light-hearted and irreverent works, he also wrote serious, sombre and religious pieces beginning in the 1930s.",,,Its main implementation is the Glasgow Haskell Compiler.,3,,,,,,,,,,,,,,,,,,No,,No,Yes,,"Here's looking at you, kid.",No,,Those who refuse to learn from history are condemned to repeat it.,Yes,Yes,,,,,,,,,,,,,,,,,,,,,Yes,,Tuples are containers for a fixed number of Erlang data types.,,,,No,,No,Yes,No,Yes,No,,Yes,,No,,,,hdfs://dnt01/ons/covserolink/landing_zone/responses_v0/ONS_Datafile_20211108.csv,,,,,,,,,,,,,,,,,,,,,,,,,,,,,,,,,,,,,,,,,,,,,,,,,,,,,,,,,,,,,,,No,No,,No,Yes,Yes,Yes,,No,,,No,Yes,No,No,,4
